<?xml version="1.0" encoding="UTF-8" standalone="no"?>
<xs:schema elementFormDefault="qualified" targetNamespace="http://earthdawn.com/items" xmlns="http://earthdawn.com/items" xmlns:xs="http://www.w3.org/2001/XMLSchema" xmlns:edt="http://earthdawn.com/datatypes">
	<xs:import namespace="http://earthdawn.com/datatypes" schemaLocation="earthdawndatatypes.xsd"/>
	<xs:element name="ITEMS">
		<xs:complexType>
			<xs:sequence>
				<xs:element minOccurs="0" maxOccurs="unbounded" name="ARMOR" type="edt:ARMOR_type"/>
				<xs:element minOccurs="0" maxOccurs="unbounded" name="SHIELD" type="edt:SHIELD_type"/>
				<xs:element minOccurs="0" maxOccurs="unbounded" name="WEAPON" type="edt:WEAPON_type"/>
				<xs:element minOccurs="0" maxOccurs="unbounded" name="AMMUNITION" type="edt:AMMUNITION_type"/>
				<xs:element minOccurs="0" maxOccurs="unbounded" name="MAGICITEM" type="edt:MAGICITEM_type"/>
				<xs:element minOccurs="0" maxOccurs="unbounded" name="PATTERNITEM" type="edt:PATTERNITEM_type"/>
				<xs:element minOccurs="0" maxOccurs="unbounded" name="BLOODCHARMITEM" type="edt:BLOODCHARMITEM_type"/>
				<xs:element minOccurs="0" maxOccurs="unbounded" name="THREADITEM" type="edt:THREADITEM_type"/>
				<xs:element minOccurs="0" maxOccurs="unbounded" name="ITEM" type="edt:ITEM_type"/>
			</xs:sequence>
			<xs:attribute name="lang" type="xs:string" use="required"/>
		</xs:complexType>
	</xs:element>
</xs:schema>
